{
  "run_id": "2026-09-07",
  "generated_at": "2026-09-07T12:09:46",
  "project": "coforge",
  "session": {
    "turns": 7116,
    "duration_min": 18853.5,
    "transcripts": 3
  },
  "tokens": {
    "input": 14204,
    "output": 8360102,
    "cache_read": 3620741062,
    "cache_creation": 65889375,
    "billable": 8374306
  },
  "tools": {
    "Bash": 1731,
    "Edit": 251,
    "mcp__chrome-devtools__evaluate_script": 124,
    "mcp__figma-console__figma_execute": 124,
    "Write": 114,
    "Agent": 79,
    "mcp__claude-in-chrome__javascript_tool": 79,
    "mcp__Claude_Browser__computer": 71,
    "Artifact": 57,
    "mcp__claude-in-chrome__navigate": 44,
    "SendUserFile": 39,
    "ToolSearch": 32,
    "mcp__chrome-devtools__take_screenshot": 29,
    "Read": 29,
    "mcp__Claude_Browser__javascript_tool": 25,
    "mcp__Claude_Browser__navigate": 22,
    "mcp__figma-console__figma_delete_variable": 22,
    "AskUserQuestion": 21,
    "mcp__chrome-devtools__navigate_page": 20,
    "mcp__claude-in-chrome__computer": 20,
    "mcp__Claude_Browser__resize_window": 19,
    "mcp__figma-console__figma_import_tokens": 16,
    "mcp__Claude_Browser__preview_start": 15,
    "mcp__Claude_Browser__browser_batch": 14,
    "mcp__claude-in-chrome__find": 13,
    "WebSearch": 10,
    "Skill": 9,
    "mcp__Claude_Browser__read_page": 8,
    "mcp__chrome-devtools__new_page": 8,
    "mcp__figma-console__figma_delete_variable_collection": 8,
    "WebFetch": 7,
    "mcp__ccd_session__mark_chapter": 7,
    "mcp__Claude_Browser__get_page_text": 7,
    "mcp__c9aab61a-50cd-4017-8c31-f94e774e161b__figma_get_variables": 6,
    "mcp__figma-console__figma_get_variables": 6,
    "mcp__figma-console__figma_export_tokens": 6,
    "mcp__figma-console__figma_take_screenshot": 6,
    "mcp__chrome-devtools__emulate": 5,
    "mcp__chrome-devtools__resize_page": 5,
    "mcp__claude-in-chrome__tabs_context_mcp": 5,
    "mcp__c9aab61a-50cd-4017-8c31-f94e774e161b__figma_pair_plugin": 4,
    "mcp__figma-console__figma_get_status": 4,
    "mcp__claude-in-chrome__browser_batch": 4,
    "mcp__chrome-devtools__list_pages": 3,
    "mcp__Claude_Browser__find": 2,
    "mcp__ccd_session_mgmt__set_session_title": 2,
    "mcp__Claude_Browser__tabs_close": 2,
    "mcp__chrome-devtools__list_network_requests": 2,
    "mcp__c9aab61a-50cd-4017-8c31-f94e774e161b__figma_get_design_system_kit": 2,
    "mcp__figma-console__figma_list_open_files": 2,
    "mcp__figma-console__figma_navigate": 2,
    "mcp__figma-console__figma_capture_screenshot": 2,
    "mcp__claude-in-chrome__list_connected_browsers": 2,
    "mcp__chrome-devtools__take_snapshot": 2,
    "mcp__Claude_Browser__read_console_messages": 1,
    "mcp__Claude_Browser__tabs_context": 1,
    "mcp__Claude_Browser__preview_stop": 1,
    "mcp__Claude_Browser__tabs_create": 1,
    "SearchSkills": 1
  },
  "skills": {
    "artifact-design": 5,
    "anthropic-skills:docx": 1,
    "dataviz": 1,
    "impeccable": 1,
    "luma-competitor-analysis-pro": 1
  },
  "artifacts": {
    "total": 26,
    "live": 19,
    "by_type": {
      "brand-extraction": 1,
      "competitive-benchmark": 7,
      "a11y-audit": 3,
      "component-spec": 4,
      "prioritization": 2,
      "dashboard": 6,
      "research-plan": 1,
      "ux-copy": 1,
      "metrics-scorecard": 1
    },
    "by_status": {
      "in-review": 3,
      "approved": 2,
      "superseded": 7,
      "draft": 14
    },
    "tokens_per_artifact": 322089
  },
  "gates": {
    "verdict": "FAIL",
    "blocker": 5,
    "error": 2,
    "warning": 5,
    "info": 6,
    "skipped": 0,
    "source": "live-audit"
  },
  "corrections": {
    "logged": 45,
    "with_check": 34,
    "unchecked": 11,
    "source": "validation/corrections.json"
  },
  "governance": {
    "adrs": 22,
    "agents": 14,
    "artifact_types": 41
  },
  "readiness": {
    "l1": 100.0,
    "l2": 66.0,
    "workflow": 100.0
  }
}