{
  "run_id": "2026-09-09",
  "generated_at": "2026-09-09T18:12:17",
  "project": "coforge",
  "provenance": {
    "schema_version": "2",
    "counting_method": "uuid-dedup-v1",
    "detail": "validation/metrics.schema.json"
  },
  "session": {
    "turns": 6678,
    "transcripts": 5,
    "unique_records": 17660,
    "non_message_records": 3213,
    "active_minutes_distinct": 1574,
    "active_hours_distinct_minutes": 26.2,
    "elapsed_span_by_day_hours": 108.4
  },
  "tokens": {
    "input": 13314,
    "output": 8544630,
    "cache_read": 3329231128,
    "cache_creation": 66388479,
    "billable": 8557944
  },
  "tools": {
    "Bash": 1742,
    "Edit": 126,
    "mcp__chrome-devtools__evaluate_script": 116,
    "mcp__figma-console__figma_execute": 94,
    "mcp__claude-in-chrome__javascript_tool": 79,
    "Agent": 70,
    "mcp__Claude_Browser__computer": 66,
    "Write": 61,
    "Read": 45,
    "mcp__claude-in-chrome__navigate": 44,
    "SendUserFile": 39,
    "mcp__Claude_Browser__javascript_tool": 36,
    "mcp__Claude_Browser__browser_batch": 35,
    "Artifact": 35,
    "ToolSearch": 27,
    "mcp__chrome-devtools__take_screenshot": 26,
    "AskUserQuestion": 20,
    "mcp__Claude_Browser__navigate": 20,
    "mcp__chrome-devtools__navigate_page": 20,
    "mcp__claude-in-chrome__computer": 20,
    "mcp__Claude_Browser__resize_window": 19,
    "Skill": 13,
    "mcp__claude-in-chrome__find": 13,
    "mcp__Claude_Browser__preview_start": 12,
    "mcp__figma-console__figma_delete_variable": 11,
    "WebSearch": 10,
    "mcp__ccd_session__mark_chapter": 8,
    "mcp__chrome-devtools__resize_page": 8,
    "mcp__figma-console__figma_import_tokens": 8,
    "mcp__figma-console__figma_take_screenshot": 8,
    "WebFetch": 7,
    "mcp__Claude_Browser__get_page_text": 7,
    "mcp__Claude_Browser__read_page": 7,
    "mcp__chrome-devtools__new_page": 5,
    "mcp__claude-in-chrome__tabs_context_mcp": 5,
    "mcp__chrome-devtools__list_pages": 5,
    "mcp__figma-console__figma_delete_variable_collection": 4,
    "mcp__claude-in-chrome__browser_batch": 4,
    "mcp__chrome-devtools__emulate": 3,
    "mcp__c9aab61a-50cd-4017-8c31-f94e774e161b__figma_get_variables": 3,
    "mcp__figma-console__figma_get_status": 3,
    "mcp__figma-console__figma_get_variables": 3,
    "mcp__figma-console__figma_export_tokens": 3,
    "mcp__Claude_Browser__find": 2,
    "mcp__ccd_session_mgmt__set_session_title": 2,
    "mcp__c9aab61a-50cd-4017-8c31-f94e774e161b__figma_pair_plugin": 2,
    "mcp__claude-in-chrome__list_connected_browsers": 2,
    "mcp__chrome-devtools__take_snapshot": 2,
    "SearchSkills": 2,
    "mcp__ccd_directory__request_directory": 1,
    "mcp__Claude_Browser__read_console_messages": 1,
    "mcp__Claude_Browser__tabs_context": 1,
    "mcp__Claude_Browser__preview_stop": 1,
    "mcp__Claude_Browser__tabs_close": 1,
    "mcp__chrome-devtools__list_network_requests": 1,
    "mcp__c9aab61a-50cd-4017-8c31-f94e774e161b__figma_get_design_system_kit": 1,
    "mcp__figma-console__figma_list_open_files": 1,
    "mcp__figma-console__figma_navigate": 1,
    "mcp__figma-console__figma_capture_screenshot": 1,
    "mcp__Claude_Browser__tabs_create": 1,
    "mcp__figma-console__figjam_get_board_contents": 1
  },
  "skills": {
    "artifact-design": 4,
    "dataviz": 3,
    "anthropic-skills:docx": 1,
    "impeccable": 1,
    "luma-competitor-analysis-pro": 1,
    "data:create-viz": 1,
    "figma:figma-use": 1,
    "claude-api": 1
  },
  "artifacts": {
    "total": 30,
    "live": 22,
    "by_type": {
      "brand-extraction": 1,
      "competitive-benchmark": 7,
      "a11y-audit": 3,
      "component-spec": 4,
      "handoff-spec": 1,
      "prioritization": 2,
      "dashboard": 8,
      "research-plan": 1,
      "ux-copy": 1,
      "interview-analysis": 1,
      "metrics-scorecard": 1
    },
    "by_status": {
      "in-review": 3,
      "approved": 2,
      "superseded": 8,
      "draft": 17
    },
    "tokens_per_artifact": 285265
  },
  "gates": {
    "verdict": "PASS",
    "blocker": 0,
    "error": 0,
    "warning": 7,
    "info": 7,
    "skipped": 0,
    "source": "live-audit"
  },
  "corrections": {
    "logged": 58,
    "with_check": 46,
    "unchecked": 12,
    "source": "validation/corrections.json"
  },
  "governance": {
    "adrs": 24,
    "agents": 14,
    "artifact_types": 41
  },
  "readiness": {
    "l1": 100.0,
    "l2": 66.0,
    "workflow": 100.0
  }
}