{
  "run_id": "2026-09-16",
  "generated_at": "2026-09-16T09:07:07",
  "project": "coforge",
  "provenance": {
    "schema_version": "2",
    "counting_method": "uuid-dedup-v1",
    "detail": "validation/metrics.schema.json"
  },
  "session": {
    "turns": 8215,
    "transcripts": 9,
    "unique_records": 22606,
    "non_message_records": 4322,
    "active_minutes_distinct": 1975,
    "active_hours_distinct_minutes": 32.9,
    "elapsed_span_by_day_hours": 146.2
  },
  "tokens": {
    "input": 16491,
    "output": 11399656,
    "cache_read": 3769375301,
    "cache_creation": 86592552,
    "billable": 11416147
  },
  "tools": {
    "Bash": 2038,
    "Edit": 167,
    "mcp__figma-console__figma_execute": 150,
    "Write": 125,
    "mcp__chrome-devtools__evaluate_script": 116,
    "Read": 110,
    "mcp__Claude_Browser__computer": 100,
    "Agent": 87,
    "mcp__claude-in-chrome__javascript_tool": 79,
    "SendUserFile": 47,
    "mcp__claude-in-chrome__navigate": 44,
    "mcp__Claude_Browser__javascript_tool": 43,
    "mcp__Claude_Browser__browser_batch": 40,
    "ToolSearch": 36,
    "Artifact": 35,
    "mcp__chrome-devtools__take_screenshot": 26,
    "AskUserQuestion": 25,
    "mcp__Claude_Browser__navigate": 23,
    "WebSearch": 20,
    "mcp__Claude_Browser__resize_window": 20,
    "mcp__chrome-devtools__navigate_page": 20,
    "mcp__claude-in-chrome__computer": 20,
    "mcp__c9aab61a-50cd-4017-8c31-f94e774e161b__figma_execute": 17,
    "mcp__Claude_Browser__preview_start": 16,
    "Skill": 15,
    "mcp__figma-console__figma_take_screenshot": 14,
    "mcp__ccd_session__mark_chapter": 13,
    "mcp__figma-console__figma_capture_screenshot": 13,
    "mcp__claude-in-chrome__find": 13,
    "WebFetch": 12,
    "mcp__figma-console__figma_delete_variable": 11,
    "mcp__chrome-devtools__resize_page": 8,
    "mcp__figma-console__figma_import_tokens": 8,
    "mcp__Claude_Browser__get_page_text": 7,
    "mcp__Claude_Browser__read_page": 7,
    "mcp__figma-console__figma_navigate": 7,
    "mcp__Claude_Browser__read_console_messages": 6,
    "mcp__c9aab61a-50cd-4017-8c31-f94e774e161b__figma_capture_screenshot": 6,
    "mcp__claude-in-chrome__tabs_context_mcp": 6,
    "mcp__chrome-devtools__new_page": 5,
    "mcp__figma-console__figma_get_status": 5,
    "mcp__figma-console__figma_get_variables": 5,
    "mcp__chrome-devtools__list_pages": 5,
    "mcp__c9aab61a-50cd-4017-8c31-f94e774e161b__figma_pair_plugin": 4,
    "mcp__figma-console__figma_delete_variable_collection": 4,
    "mcp__claude-in-chrome__browser_batch": 4,
    "SearchSkills": 3,
    "mcp__Claude_Browser__find": 3,
    "mcp__chrome-devtools__emulate": 3,
    "mcp__c9aab61a-50cd-4017-8c31-f94e774e161b__figma_get_variables": 3,
    "mcp__figma-console__figma_export_tokens": 3,
    "mcp__c9aab61a-50cd-4017-8c31-f94e774e161b__figjam_get_board_contents": 3,
    "mcp__Claude_Browser__tabs_create": 2,
    "mcp__ccd_session_mgmt__set_session_title": 2,
    "mcp__figma-console__figma_list_open_files": 2,
    "mcp__figma-console__figma_get_file_data": 2,
    "mcp__figma-console__figjam_get_board_contents": 2,
    "mcp__claude-in-chrome__list_connected_browsers": 2,
    "mcp__chrome-devtools__take_snapshot": 2,
    "mcp__ccd_directory__request_directory": 1,
    "mcp__Claude_Browser__tabs_context": 1,
    "mcp__Claude_Browser__preview_stop": 1,
    "mcp__Claude_Browser__tabs_close": 1,
    "mcp__chrome-devtools__list_network_requests": 1,
    "mcp__c9aab61a-50cd-4017-8c31-f94e774e161b__figma_get_design_system_kit": 1,
    "mcp__ccd_session__spawn_task": 1,
    "mcp__visualize__read_me": 1,
    "mcp__visualize__show_widget": 1
  },
  "skills": {
    "dataviz": 4,
    "artifact-design": 4,
    "anthropic-skills:docx": 1,
    "persona-dashboard": 1,
    "impeccable": 1,
    "luma-competitor-analysis-pro": 1,
    "data:create-viz": 1,
    "figma:figma-use": 1,
    "claude-api": 1
  },
  "artifacts": {
    "total": 31,
    "live": 23,
    "by_type": {
      "brand-extraction": 1,
      "competitive-benchmark": 7,
      "a11y-audit": 3,
      "component-spec": 4,
      "handoff-spec": 1,
      "prioritization": 2,
      "dashboard": 8,
      "research-plan": 1,
      "ux-copy": 1,
      "interview-analysis": 1,
      "persona": 1,
      "metrics-scorecard": 1
    },
    "by_status": {
      "in-review": 3,
      "approved": 2,
      "superseded": 8,
      "draft": 18
    },
    "tokens_per_artifact": 368263
  },
  "gates": {
    "verdict": "FAIL",
    "blocker": 2,
    "error": 0,
    "warning": 7,
    "info": 7,
    "skipped": 0,
    "source": "live-audit"
  },
  "corrections": {
    "logged": 58,
    "with_check": 46,
    "unchecked": 12,
    "source": "validation/corrections.json"
  },
  "governance": {
    "adrs": 24,
    "agents": 14,
    "artifact_types": 41
  },
  "readiness": {
    "l1": 100.0,
    "l2": 76.0,
    "workflow": 100.0
  }
}