{
  "run_id": "2026-09-03",
  "generated_at": "2026-09-03T23:45:22",
  "project": "coforge",
  "session": {
    "turns": 5764,
    "duration_min": 13789.1,
    "transcripts": 3
  },
  "tokens": {
    "input": 11502,
    "output": 6716121,
    "cache_read": 2895365407,
    "cache_creation": 57807811,
    "billable": 6727623
  },
  "tools": {
    "Bash": 1471,
    "Edit": 250,
    "mcp__figma-console__figma_execute": 124,
    "Write": 114,
    "mcp__Claude_Browser__computer": 71,
    "Agent": 71,
    "Artifact": 53,
    "mcp__chrome-devtools__evaluate_script": 34,
    "ToolSearch": 29,
    "SendUserFile": 27,
    "mcp__Claude_Browser__javascript_tool": 24,
    "mcp__Claude_Browser__navigate": 22,
    "mcp__figma-console__figma_delete_variable": 22,
    "Read": 21,
    "AskUserQuestion": 20,
    "mcp__Claude_Browser__resize_window": 19,
    "mcp__figma-console__figma_import_tokens": 16,
    "mcp__Claude_Browser__preview_start": 15,
    "WebSearch": 10,
    "mcp__chrome-devtools__take_screenshot": 10,
    "Skill": 8,
    "mcp__Claude_Browser__read_page": 8,
    "mcp__Claude_Browser__browser_batch": 8,
    "mcp__chrome-devtools__new_page": 8,
    "mcp__figma-console__figma_delete_variable_collection": 8,
    "WebFetch": 7,
    "mcp__Claude_Browser__get_page_text": 7,
    "mcp__c9aab61a-50cd-4017-8c31-f94e774e161b__figma_get_variables": 6,
    "mcp__figma-console__figma_get_variables": 6,
    "mcp__figma-console__figma_export_tokens": 6,
    "mcp__figma-console__figma_take_screenshot": 6,
    "mcp__chrome-devtools__emulate": 4,
    "mcp__c9aab61a-50cd-4017-8c31-f94e774e161b__figma_pair_plugin": 4,
    "mcp__figma-console__figma_get_status": 4,
    "mcp__ccd_session__mark_chapter": 3,
    "mcp__Claude_Browser__find": 2,
    "mcp__ccd_session_mgmt__set_session_title": 2,
    "mcp__Claude_Browser__tabs_close": 2,
    "mcp__chrome-devtools__list_network_requests": 2,
    "mcp__chrome-devtools__resize_page": 2,
    "mcp__chrome-devtools__navigate_page": 2,
    "mcp__c9aab61a-50cd-4017-8c31-f94e774e161b__figma_get_design_system_kit": 2,
    "mcp__figma-console__figma_list_open_files": 2,
    "mcp__figma-console__figma_navigate": 2,
    "mcp__figma-console__figma_capture_screenshot": 2,
    "mcp__Claude_Browser__read_console_messages": 1,
    "mcp__Claude_Browser__tabs_context": 1,
    "mcp__Claude_Browser__preview_stop": 1
  },
  "skills": {
    "artifact-design": 5,
    "anthropic-skills:docx": 1,
    "dataviz": 1,
    "impeccable": 1
  },
  "artifacts": {
    "total": 20,
    "live": 15,
    "by_type": {
      "brand-extraction": 1,
      "competitive-benchmark": 6,
      "a11y-audit": 3,
      "component-spec": 4,
      "prioritization": 2,
      "dashboard": 3,
      "metrics-scorecard": 1
    },
    "by_status": {
      "in-review": 3,
      "approved": 2,
      "superseded": 5,
      "draft": 10
    },
    "tokens_per_artifact": 336381
  },
  "gates": {
    "verdict": "FAIL",
    "blocker": 1,
    "error": 2,
    "warning": 5,
    "info": 6,
    "skipped": 0,
    "source": "live-audit"
  },
  "corrections": {
    "logged": 38,
    "with_check": 31,
    "unchecked": 7,
    "source": "validation/corrections.json"
  },
  "governance": {
    "adrs": 22,
    "agents": 14,
    "artifact_types": 41
  },
  "readiness": {
    "l1": 100.0,
    "l2": 66.0,
    "workflow": 100.0
  }
}